 Applicazioni Prodotti Alimentari                      | Problemi   
 Inattivazione di microrganismi patogeni  | Salmonella, Listeria, Escherichia coli (E. coli)                
 Controllo di parassiti e insetti  | Larve di mosca, Acari, Coleotteri                             
 Rimozione di contaminanti organici | Idrocarburi policiclici aromatici (IPA), Ftalati, Cloruro di metile 
 Abbattimento di odori sgradevoli  | Ammoniaca, Solfuro di idrogeno, Mercaptano                   
 Decadimento di disinfettanti chimici  | Cloro, Perossido di idrogeno, Iodio                          
 Riduzione di prodotti farmaceutici  | Antibiotici, Antinfiammatori, Vitamine                        
 Rimozione di pesticidi ed erbicidi  | Glifosato, Diclorofos, Neonicotinoidi                       
 Ossidazione di metalli pesanti     | Piombo, Cadmio, Mercurio                                       