 Applicazioni Prodotti Alimentari                      | Problemi   
 Inattivazione di microrganismi patogeni       | Escherichia coli, Salmonella, Listeria  
 Controllo di parassiti e insetti              | Acari, Coleotteri, Mosche della frutta  
 Rimozione di contaminanti organici            | Aflatossine, Molecole fenoliche, Micotossine  
 Abbattimento di odori sgradevoli              | Geosmina, 2,4,6-Tricloroanisolo, Indoli  
 Decadimento di disinfettati chimici           | Cloro, Perossido di idrogeno, Iodio  
 Riduzione di prodotti farmaceutici            | Sulfamidici, Antibiotici, Analgesici  
 Rimozione di pesticidi ed erbicidi            | Captano, Glifosato, Pirazophos  
 Ossidazione di metalli pesanti                | Piombo, Cadmio, Mercurio  