 Applicazioni Acqua Processo                      | Problemi   
 Inattivazione di batteri e virus | Salmonella, Campylobacter, E. coli 
 Controllo di muffe | Aspergillus, Penicillium, Fusarium 
 Estirpazione di alghe | Chlorella, Microcystis, Oscillatoria 
 Rimozione di contaminanti organici | BOD (Biochemical Oxygen Demand), COD (Chemical Oxygen Demand), TOC (Total Organic Carbon) 
 Abbattimento di odori sgradevoli | Geosmina, Metilisoborneolo (MIB), Solfuro di idrogeno (H2S) 
 Decadimento di disinfettati chimici | Cloro, Biossido di cloro, Acido peracetico 
 Rimozione di pesticidi ed erbicidi | Clorpirifos, Diclorofos, Glyphosate 
 Ossidazione di metalli pesanti | Piombo (Pb), Cadmio (Cd), Mercurio (Hg) 